{
	"$schema": "https://anthropic.com/claude-code/marketplace.schema.json",
	"name": "topographic-studio-plugins",
	"version": "1.0.0",
	"description": "Topographic Studio plugins for Claude Code - crawling, product strategy, and technical engineering agents",
	"owner": {
		"name": "Leo Brival",
		"email": "leo.brival@gmail.com"
	},
	"plugins": [
		{
			"name": "crawler",
			"description": "High-performance web crawler for discovering and mapping website structure",
			"version": "1.0.0",
			"author": {
				"name": "Leo Brival",
				"email": "leo.brival@gmail.com"
			},
			"source": "./plugins/crawler",
			"category": "productivity"
		},
		{
			"name": "ideabrowser",
			"description": "Product and marketing agents for ideation, strategy, and execution",
			"version": "1.0.0",
			"author": {
				"name": "Leo Brival",
				"email": "leo.brival@gmail.com"
			},
			"source": "./plugins/ideabrowser",
			"category": "productivity"
		},
		{
			"name": "roadmap",
			"description": "Technical engineering agents for software development and architecture",
			"version": "1.0.0",
			"author": {
				"name": "Leo Brival",
				"email": "leo.brival@gmail.com"
			},
			"source": "./plugins/roadmap",
			"category": "development"
		},
		{
			"name": "security-hooks",
			"description": "Security validation hooks with command validation, linting and type checking",
			"version": "1.0.0",
			"author": {
				"name": "Leo Brival",
				"email": "leo.brival@gmail.com"
			},
			"source": "./plugins/security-hooks",
			"category": "security"
		},
		{
			"name": "hookify",
			"description": "Enhanced hookify with 24 security rules - Bun runtime, no Python required",
			"version": "1.0.0",
			"author": {
				"name": "Leo Brival",
				"email": "leo.brival@gmail.com"
			},
			"source": "./plugins/hookify",
			"category": "security"
		},
		{
			"name": "speckit",
			"description": "Spec-kit CLI manager - install, update, version check, and project initialization",
			"version": "1.0.0",
			"author": {
				"name": "Leo Brival",
				"email": "leo.brival@gmail.com"
			},
			"source": "./plugins/speckit",
			"category": "development"
		},
		{
			"name": "cli-toolkit",
			"description": "CLI reference commands for popular development tools - GitHub, Docker, Vercel, Railway, and more",
			"version": "1.0.0",
			"author": {
				"name": "Leo Brival",
				"email": "leo.brival@gmail.com"
			},
			"source": "./plugins/cli-toolkit",
			"category": "productivity"
		},
		{
			"name": "github-commands",
			"description": "GitHub and Git workflow commands - commits, PRs, worktrees, debugging, and branch management",
			"version": "1.0.0",
			"author": {
				"name": "Leo Brival",
				"email": "leo.brival@gmail.com"
			},
			"source": "./plugins/github-commands",
			"category": "development"
		},
		{
			"name": "code-workflows",
			"description": "Development workflow commands - EPCT methodology and production-ready logging setup",
			"version": "1.0.0",
			"author": {
				"name": "Leo Brival",
				"email": "leo.brival@gmail.com"
			},
			"source": "./plugins/code-workflows",
			"category": "development"
		}
	]
}
